{
  "$schema": "https://json-schema.org/draft/2020-12/schema",
  "title": "HighPerfASR Benchmark Report",
  "version": "v1alpha2",
  "type": "object",
  "required": ["schema_version", "report_id", "generated_at", "protocol_version", "sut", "hardware", "software", "dataset", "scenario", "quality", "performance", "reliability", "resources", "reproduction", "environment", "cost"],
  "properties": {
    "schema_version": {
      "type": "string",
      "description": "Report schema version"
    },
    "report_id": {
      "type": "string",
      "description": "Unique report identifier"
    },
    "generated_at": {
      "type": "string",
      "format": "date-time"
    },
    "protocol_version": {
      "type": "string",
      "description": "HighPerfASR protocol version tested"
    },
    "sut": {
      "type": "object",
      "description": "System Under Test",
      "required": ["name", "implementation", "git_sha"],
      "properties": {
        "name": { "type": "string" },
        "implementation": { "type": "string", "description": "Path within highperfasr repo or external URL" },
        "git_sha": { "type": "string" },
        "model_name": { "type": "string" },
        "model_params": { "type": "string" }
      }
    },
    "hardware": {
      "type": "object",
      "required": ["gpu", "gpu_memory_gb"],
      "properties": {
        "gpu": { "type": "string" },
        "gpu_count": { "type": "integer" },
        "gpu_memory_gb": { "type": "number" },
        "cpu": { "type": "string" },
        "ram_gb": { "type": "number" }
      }
    },
    "software": {
      "type": "object",
      "required": ["cuda_version", "driver_version"],
      "properties": {
        "cuda_version": { "type": "string" },
        "driver_version": { "type": "string" },
        "pytorch_version": { "type": "string" },
        "framework_version": { "type": "string", "description": "NeMo, Whisper, etc." },
        "python_version": { "type": "string" },
        "container_image": { "type": "string" },
        "container_digest": { "type": "string" }
      }
    },
    "dataset": {
      "type": "object",
      "required": ["name", "split", "num_files", "total_audio_hours"],
      "properties": {
        "name": { "type": "string" },
        "split": { "type": "string" },
        "num_files": { "type": "integer" },
        "total_audio_hours": { "type": "number" },
        "license": { "type": "string" },
        "manifest_sha256": { "type": "string" }
      }
    },
    "scenario": {
      "type": "object",
      "required": ["name", "mode"],
      "properties": {
        "name": { "type": "string" },
        "mode": { "type": "string", "enum": ["offline", "server", "streaming-realtime", "streaming-saturation", "long-form", "soak", "overload"] },
        "concurrency": { "type": "integer" },
        "duration_seconds": { "type": "number" },
        "description": { "type": "string" }
      }
    },
    "quality": {
      "type": "object",
      "properties": {
        "wer": { "type": "number", "description": "Word Error Rate (0-100)" },
        "reference_wer": { "type": ["number", "null"], "description": "Reference model WER (0-100) for WER delta gates" },
        "max_load_wer": { "type": ["number", "null"], "description": "Word Error Rate measured under max stable load (0-100)" },
        "cer": { "type": "number", "description": "Character Error Rate (0-100)" },
        "normalization": { "type": "string", "description": "Text normalization method used" }
      }
    },
    "performance": {
      "type": "object",
      "properties": {
        "rtfx": { "type": "number", "description": "Real-Time Factor (>1 means faster than real-time)" },
        "sessions_per_min": { "type": "number" },
        "rps": { "type": "number", "description": "Requests per second (batch mode)" },
        "p50_ms": { "type": "number" },
        "p95_ms": { "type": "number" },
        "p99_ms": { "type": "number" },
        "lag_p95_ms": { "type": ["number", "null"], "description": "Streaming lag p95 beyond realtime audio duration" },
        "rt_compliance_pct": { "type": ["number", "null"], "description": "Percent of streams that stayed within realtime lag tolerance" },
        "max_concurrent_streams": { "type": "integer" }
      }
    },
    "reliability": {
      "type": "object",
      "properties": {
        "total_requests": { "type": "integer" },
        "successful": { "type": "integer" },
        "failed": { "type": "integer" },
        "failure_rate": { "type": "number" }
      }
    },
    "resources": {
      "type": "object",
      "properties": {
        "vram_baseline_mb": { "type": ["number", "null"] },
        "vram_highwater_mb": { "type": ["number", "null"] },
        "vram_growth_mb": { "type": ["number", "null"] },
        "vram_total_mb": { "type": "number" },
        "vram_utilization": { "type": "number", "description": "0-1 fraction" }
      }
    },
    "reproduction": {
      "type": "object",
      "required": ["command"],
      "properties": {
        "command": { "type": "string", "description": "Exact command to reproduce" },
        "config_file": { "type": "string" },
        "notes": { "type": "string" }
      }
    },
    "environment": {
      "type": "object",
      "description": "Cloud/infrastructure environment where the benchmark ran",
      "required": ["provider", "region", "kubernetes_distribution", "instance_type", "capacity_type", "recipe"],
      "properties": {
        "provider": { "type": "string", "enum": ["gcp", "aws", "azure", "onprem", "other"] },
        "region": { "type": "string" },
        "zone": { "type": "string" },
        "kubernetes_distribution": { "type": "string", "enum": ["gke", "eks", "aks", "self-managed", "other"] },
        "kubernetes_version": { "type": "string" },
        "instance_type": { "type": "string", "description": "Cloud SKU: g2-standard-4, g6.xlarge, Standard_NV36ads_A10_v5" },
        "capacity_type": { "type": "string", "enum": ["on-demand", "spot", "preemptible", "reserved", "unknown"] },
        "recipe": { "type": "string", "description": "Kustomize recipe path used for deployment" }
      }
    },
    "cost": {
      "type": "object",
      "description": "Cost normalization for cross-provider comparison",
      "required": ["currency", "pricing_model", "price_source", "price_as_of", "node_usd_per_hour", "usd_per_audio_hour"],
      "properties": {
        "currency": { "type": "string", "default": "USD" },
        "pricing_model": { "type": "string", "enum": ["on-demand", "spot", "preemptible", "reserved", "unknown"] },
        "price_source": { "type": "string", "description": "Where the price was looked up" },
        "price_as_of": { "type": "string", "format": "date", "description": "Date pricing was checked" },
        "node_usd_per_hour": { "type": "number" },
        "wall_clock_seconds": { "type": "number" },
        "usd_per_audio_hour": { "type": "number", "description": "instance_price / processed_audio_hours_per_wall_hour" }
      }
    },
    "artifacts": {
      "type": "array",
      "items": {
        "type": "object",
        "properties": {
          "name": { "type": "string" },
          "path": { "type": "string" },
          "description": { "type": "string" }
        }
      }
    }
  },
  "allOf": [
    {
      "if": {
        "properties": {
          "dataset": {
            "properties": { "name": { "pattern": "^(LibriSpeech|Earnings-22|AMI)" } },
            "required": ["name"]
          },
          "scenario": {
            "properties": { "mode": { "enum": ["offline", "server", "long-form"] } },
            "required": ["mode"]
          }
        },
        "required": ["dataset", "scenario"]
      },
      "then": {
        "properties": {
          "quality": { "required": ["wer", "reference_wer", "max_load_wer"] },
          "resources": { "required": ["vram_growth_mb"] }
        }
      }
    },
    {
      "if": {
        "properties": {
          "scenario": {
            "properties": {
              "mode": { "enum": ["streaming-realtime", "streaming-saturation", "soak"] }
            },
            "required": ["mode"]
          }
        },
        "required": ["scenario"]
      },
      "then": {
        "properties": {
          "scenario": { "required": ["duration_seconds"] },
          "quality": { "required": ["wer", "reference_wer", "max_load_wer"] },
          "performance": { "required": ["rt_compliance_pct", "lag_p95_ms"] },
          "resources": { "required": ["vram_growth_mb"] }
        }
      }
    }
  ]
}
