{
  "schema_version": "v1alpha2",
  "report_id": "2026-t4-nemo-batch",
  "generated_at": "2026-07-12T12:52:57Z",
  "protocol_version": "v1alpha1",
  "sut": {
    "name": "NeMo FastAPI Server (batch mode)",
    "implementation": "labs/nemo-fastapi",
    "git_sha": "d3870dc",
    "model_name": "nvidia/parakeet-tdt-0.6b-v3",
    "model_params": "0.6B"
  },
  "hardware": {
    "gpu": "NVIDIA T4",
    "gpu_count": 1,
    "gpu_memory_gb": 16,
    "cpu": "GKE n1-standard-4",
    "ram_gb": 15
  },
  "software": {
    "cuda_version": "12.8",
    "driver_version": "570.86.15",
    "pytorch_version": "2.6.0",
    "framework_version": "NeMo 2.5",
    "python_version": "3.11",
    "container_image": "nvcr.io/nvidia/nemo:26.02"
  },
  "dataset": {
    "name": "LibriSpeech",
    "split": "test-clean",
    "num_files": 200,
    "total_audio_hours": 0.41,
    "license": "CC-BY-4.0"
  },
  "scenario": {
    "name": "batch-concurrency-sweep",
    "mode": "offline",
    "concurrency": 64,
    "description": "REST batch transcription concurrency sweep c=1..64 with LibriSpeech test-clean on T4 GPU"
  },
  "quality": {
    "wer": 1.86,
    "reference_wer": 1.57,
    "max_load_wer": 1.86,
    "normalization": "Whisper EnglishTextNormalizer (lowercase, expand contractions, strip punctuation)"
  },
  "performance": {
    "rtfx": 65.2,
    "rps": 7.17,
    "p50_ms": 6714,
    "p99_ms": 40037,
    "max_concurrent_streams": 64
  },
  "reliability": {
    "total_requests": 1600,
    "successful": 1600,
    "failed": 0,
    "failure_rate": 0.0
  },
  "resources": {
    "vram_baseline_mb": 0,
    "vram_highwater_mb": 0,
    "vram_growth_mb": 0,
    "vram_total_mb": 16384
  },
  "reproduction": {
    "command": "python3 benchmarks/scripts/bench_batch.py --server http://localhost:8000 --concurrency 1,8,16,32,64",
    "config_file": "recipes/gcp-t4/serving-batch-t4.yaml",
    "notes": "Run inside NGC nemo:26.02 container on GKE with T4 GPU. torch.compile and CUDA graphs disabled for Turing architecture. Batch size reduced to 16."
  },
  "environment": {
    "provider": "gcp",
    "region": "us-central1",
    "kubernetes_distribution": "gke",
    "instance_type": "n1-standard-4",
    "capacity_type": "on-demand",
    "recipe": "recipes/gcp-t4"
  },
  "cost": {
    "currency": "USD",
    "pricing_model": "on-demand",
    "price_source": "GCP n1-standard-4 + T4 GPU on-demand reference price",
    "price_as_of": "2026-07-12",
    "node_usd_per_hour": 0.35,
    "usd_per_audio_hour": 0.0054
  },
  "artifacts": [
    {
      "name": "concurrency_sweep",
      "path": "concurrency-sweep.json",
      "description": "Full concurrency sweep results (c=1 to c=64)"
    }
  ]
}
