{
  "schema_version": "v1alpha2",
  "report_id": "2026-l4-nemo-batch",
  "generated_at": "2026-07-10T00:00:00Z",
  "protocol_version": "v1alpha1",
  "sut": {
    "name": "NeMo FastAPI Server (batch mode)",
    "implementation": "labs/nemo-fastapi",
    "git_sha": "eb79ddf",
    "model_name": "nvidia/parakeet-tdt-0.6b-v3",
    "model_params": "0.6B"
  },
  "hardware": {
    "gpu": "NVIDIA L4",
    "gpu_count": 1,
    "gpu_memory_gb": 24,
    "cpu": "GKE n2d-standard-4",
    "ram_gb": 26
  },
  "software": {
    "cuda_version": "12.8",
    "driver_version": "570.86.15",
    "pytorch_version": "2.6.0",
    "framework_version": "NeMo 2.5",
    "python_version": "3.12",
    "container_image": "nvcr.io/nvidia/nemo:26.02"
  },
  "dataset": {
    "name": "LibriSpeech",
    "split": "test-clean",
    "num_files": 200,
    "total_audio_hours": 0.41,
    "license": "CC-BY-4.0"
  },
  "scenario": {
    "name": "batch-concurrency-sweep",
    "mode": "offline",
    "concurrency": 256,
    "description": "REST batch transcription concurrency sweep c=1..512 with LibriSpeech test-clean"
  },
  "quality": {
    "wer": 1.57,
    "reference_wer": 1.57,
    "normalization": "Whisper EnglishTextNormalizer (lowercase, expand contractions, strip punctuation)"
  },
  "performance": {
    "rtfx": 178,
    "rps": 19.5,
    "p50_ms": 10229,
    "p99_ms": 13986,
    "max_concurrent_streams": 256
  },
  "reliability": {
    "total_requests": 256,
    "successful": 256,
    "failed": 0,
    "failure_rate": 0.0
  },
  "resources": {
    "vram_baseline_mb": 8500,
    "vram_highwater_mb": 8500,
    "vram_growth_mb": 0,
    "vram_total_mb": 23034
  },
  "reproduction": {
    "command": "python3 benchmarks/scripts/bench_batch.py --server http://localhost:8000 --concurrency 1,8,32,64,128,256,512",
    "config_file": "labs/nemo-fastapi/configs/serving-batch.yaml",
    "notes": "Run inside NGC nemo:26.02 container on GKE with L4 GPU. Parakeet TDT 0.6B with VRAM-aware batch sizing."
  },
  "environment": {
    "provider": "gcp",
    "region": "us-central1",
    "kubernetes_distribution": "gke",
    "instance_type": "g2-standard-4",
    "capacity_type": "on-demand",
    "recipe": "recipes/gcp-l4"
  },
  "cost": {
    "currency": "USD",
    "pricing_model": "on-demand",
    "price_source": "GCP g2-standard-4 on-demand reference price used in README",
    "price_as_of": "2026-07-10",
    "node_usd_per_hour": 0.70,
    "usd_per_audio_hour": 0.0039
  },
  "artifacts": [
    {"name": "concurrency_sweep", "path": "concurrency-sweep.json", "description": "Full concurrency sweep results (c=1 to c=512)"}
  ]
}
